number,value,datetime_start,datetime_complete,duration,state,params_batch_size,params_data_augmentation_param,params_dataset,params_dropout_rate,params_learning_rate,params_lr-threshold,params_lr_factor,params_lr_patience,params_model,params_optimizer
0,11.440653705596924,2026-07-16 10:58:47.555350,2026-07-16 11:11:38.071223,0 days 00:12:50.515873,COMPLETE,24,1,fused2-agedb-imdb-utkface-wiki48,0.14416536070808084,1.099854848322476e-05,0.00011088400995703459,0.11319700997619925,7,efficientnet,adam
1,13.429789886474609,2026-07-16 11:11:38.101610,2026-07-16 11:18:40.855366,0 days 00:07:02.753756,COMPLETE,12,2,fused2-agedb-imdb-utkface-wiki48,0.16018589414970955,0.006887208515682515,2.0566177714294767e-05,0.15469650161442502,20,mobilenet,adamw
2,13.707787675857544,2026-07-16 11:18:40.876316,2026-07-16 12:01:31.541013,0 days 00:42:50.664697,COMPLETE,12,0,fused2-agedb-imdb-utkface-wiki48,0.3864120720225874,0.007931162994690483,0.00012716559101701055,0.4183140386365385,12,vgg19,adamw
3,13.488203951517741,2026-07-16 12:01:31.571313,2026-07-16 12:23:43.922410,0 days 00:22:12.351097,COMPLETE,8,0,fused2-agedb-imdb-utkface-wiki48,0.4980745365676237,0.0004384087940082618,3.890329193065993e-05,0.33975790110763415,14,vgg16,adam
4,11.273695971171062,2026-07-16 12:23:43.945284,2026-07-16 12:58:57.447056,0 days 00:35:13.501772,COMPLETE,8,13,fused2-agedb-imdb-utkface-wiki48,0.22920122597289083,1.7323174983561766e-05,0.0009948325359885116,0.1655802137463251,12,vgg16,adam
5,10.963312814110203,2026-07-16 12:58:57.473238,2026-07-16 13:15:25.182305,0 days 00:16:27.709067,COMPLETE,16,1,fused2-agedb-imdb-utkface-wiki48,0.3006795716153788,0.00020293184656236518,4.8673968470573e-05,0.47423886860453013,19,resnet18,adamw
6,13.467485729016756,2026-07-16 13:15:25.213776,2026-07-16 13:27:10.706026,0 days 00:11:45.492250,PRUNED,32,17,fused2-agedb-imdb-utkface-wiki48,0.4219162670654082,0.0005771142445754648,0.0001731869341105412,0.4631252747507377,18,vgg19,adamw
7,10.982997411092123,2026-07-16 13:27:10.730438,2026-07-16 13:42:31.185312,0 days 00:15:20.454874,COMPLETE,8,5,fused2-agedb-imdb-utkface-wiki48,0.4305038850175965,0.005698571650979358,0.0005388384609229824,0.29877027140047324,9,efficientnet,adam
8,10.694241523742676,2026-07-16 13:42:31.214920,2026-07-16 13:50:03.325434,0 days 00:07:32.110514,COMPLETE,28,20,fused2-agedb-imdb-utkface-wiki48,0.3939250162994097,0.006804354185505771,0.0006065341657393894,0.18259158803429318,18,efficientnet,sgd
9,13.96739708293568,2026-07-16 13:50:03.356426,2026-07-16 13:51:48.231842,0 days 00:01:44.875416,PRUNED,28,19,fused2-agedb-imdb-utkface-wiki48,0.3862944177116313,0.007854160685019913,8.15500235425567e-05,0.3352870529063904,5,efficientnet,adam
10,28.188887977600096,2026-07-16 13:51:48.265526,2026-07-16 13:52:50.600994,0 days 00:01:02.335468,PRUNED,20,9,fused2-agedb-imdb-utkface-wiki48,0.2561604884182795,9.57890346125869e-05,1.1324414269012146e-05,0.2358098262264829,16,mobilenet,sgd
11,10.84483003616333,2026-07-16 13:52:50.626388,2026-07-16 14:28:01.341469,0 days 00:35:10.715081,COMPLETE,20,10,fused2-agedb-imdb-utkface-wiki48,0.30266761592934704,0.0011649241319033608,0.0002997274807096334,0.49117289397113617,20,resnet18,sgd
12,10.846360143025716,2026-07-16 14:28:01.367202,2026-07-16 14:46:40.693514,0 days 00:18:39.326312,COMPLETE,20,14,fused2-agedb-imdb-utkface-wiki48,0.3162505860232648,0.0015137724759349935,0.00033830645181263545,0.2490983485502698,17,resnet18,sgd
13,12.08378131866455,2026-07-16 14:46:40.726624,2026-07-16 14:55:20.640515,0 days 00:08:39.913891,PRUNED,24,8,fused2-agedb-imdb-utkface-wiki48,0.3249134854063118,0.002013705328849573,0.0003080992513740239,0.38964735539822803,20,resnet18,sgd
14,12.738614082336426,2026-07-16 14:55:20.665662,2026-07-16 15:04:00.524814,0 days 00:08:39.859152,PRUNED,24,20,fused2-agedb-imdb-utkface-wiki48,0.22394582749567116,0.001430421757625334,0.000996805806730614,0.23104677731122947,15,resnet18,sgd
15,16.921282918829668,2026-07-16 15:04:00.550190,2026-07-16 15:05:44.374513,0 days 00:01:43.824323,PRUNED,32,13,fused2-agedb-imdb-utkface-wiki48,0.4870310748265474,0.0025306594661986467,0.0002686334946695772,0.39483163603123284,18,efficientnet,sgd
16,14.241557280222574,2026-07-16 15:05:44.403415,2026-07-16 15:09:37.316892,0 days 00:03:52.913477,PRUNED,20,10,fused2-agedb-imdb-utkface-wiki48,0.35452524902223165,0.0007231683641916184,0.0005440469955162135,0.49720464712382884,13,resnet18,sgd
17,11.229102611541748,2026-07-16 15:09:37.350098,2026-07-16 15:14:58.436285,0 days 00:05:21.086187,COMPLETE,28,4,fused2-agedb-imdb-utkface-wiki48,0.27967975771729664,0.0033681994732211516,0.0005881527255643398,0.18383695963085103,16,efficientnet,sgd
18,36.83037333054976,2026-07-16 15:14:58.467466,2026-07-16 15:16:00.088746,0 days 00:01:01.621280,PRUNED,28,16,fused2-agedb-imdb-utkface-wiki48,0.45194680695842465,5.804932143481654e-05,0.00020643177182199193,0.29078847522712653,20,mobilenet,sgd
19,16.687452868411416,2026-07-16 15:16:00.114809,2026-07-16 15:20:09.479444,0 days 00:04:09.364635,PRUNED,16,11,fused2-agedb-imdb-utkface-wiki48,0.3657942815355086,0.0010149124721670543,0.00046590004495531155,0.10168026782345035,18,vgg19,sgd
20,37.19630171123304,2026-07-16 15:20:09.511389,2026-07-16 15:23:45.632255,0 days 00:03:36.120866,PRUNED,16,16,fused2-agedb-imdb-utkface-wiki48,0.1740821086690774,0.0002690689984014628,7.029982302988169e-05,0.343863238740018,10,vgg16,sgd
21,11.053058036168416,2026-07-16 15:23:45.659392,2026-07-16 15:42:38.023409,0 days 00:18:52.364017,COMPLETE,20,13,fused2-agedb-imdb-utkface-wiki48,0.3280298196646278,0.0035904349573313713,0.0003358900858553476,0.22061695632339967,17,resnet18,sgd
22,10.662984053293863,2026-07-16 15:42:38.056934,2026-07-16 16:08:02.019344,0 days 00:25:23.962410,COMPLETE,20,7,fused2-agedb-imdb-utkface-wiki48,0.3124442114372227,0.0015133074698970095,0.0003854527859408144,0.27052766810898626,17,resnet18,sgd
23,18.822762489318848,2026-07-16 16:08:02.053963,2026-07-16 16:11:45.986226,0 days 00:03:43.932263,PRUNED,24,6,fused2-agedb-imdb-utkface-wiki48,0.26323562635222414,0.004046039784135025,0.0007374281619282666,0.28155127648960526,15,resnet18,sgd
24,12.045087990007902,2026-07-16 16:11:46.016410,2026-07-16 16:21:11.354327,0 days 00:09:25.337917,PRUNED,16,7,fused2-agedb-imdb-utkface-wiki48,0.20719489869013064,0.0010298911782331069,0.00019326691029272064,0.191848186567791,19,resnet18,sgd
25,13.619682572104715,2026-07-16 16:21:11.381533,2026-07-16 16:22:58.057091,0 days 00:01:46.675558,PRUNED,28,4,fused2-agedb-imdb-utkface-wiki48,0.35636304134157365,0.002267120115592688,0.00041980415873441875,0.147360386053133,17,efficientnet,sgd
26,14.81307913462321,2026-07-16 16:22:58.084015,2026-07-16 16:26:55.409092,0 days 00:03:57.325077,PRUNED,20,10,fused2-agedb-imdb-utkface-wiki48,0.40111108417623376,0.0003359379155101994,0.0006998953682155857,0.43537709946228614,19,resnet18,sgd
27,32.84063003540039,2026-07-16 16:26:55.437431,2026-07-16 16:31:35.036768,0 days 00:04:39.599337,PRUNED,12,18,fused2-agedb-imdb-utkface-wiki48,0.3445507038819943,0.00012848022477151208,0.0002549400585048145,0.20426428496780716,15,resnet18,sgd
28,10.486133876599764,2026-07-16 16:31:35.063736,2026-07-16 16:41:21.345280,0 days 00:09:46.281544,COMPLETE,32,7,fused2-agedb-imdb-utkface-wiki48,0.2807673287068412,0.0008541037435432113,0.00016116113568024297,0.1349794134811822,16,efficientnet,adamw
29,10.63414884868421,2026-07-16 16:41:21.380017,2026-07-16 16:52:05.889160,0 days 00:10:44.509143,COMPLETE,32,3,fused2-agedb-imdb-utkface-wiki48,0.13356602125803052,0.0006372113219263449,0.00012487949077972347,0.12453810760913475,14,efficientnet,adamw
30,10.685929750141344,2026-07-16 16:52:05.923268,2026-07-16 17:00:23.737531,0 days 00:08:17.814263,COMPLETE,32,3,fused2-agedb-imdb-utkface-wiki48,0.11662696120819376,0.0006757820004257783,0.00013378636933468113,0.12272786158828339,13,efficientnet,adamw
31,10.67216948459023,2026-07-16 17:00:23.770496,2026-07-16 17:14:39.754604,0 days 00:14:15.984108,COMPLETE,32,3,fused2-agedb-imdb-utkface-wiki48,0.12235742753351848,0.0006422207233467107,0.00011858369802047147,0.13201296914194652,13,efficientnet,adamw
32,10.765709525660464,2026-07-16 17:14:39.785240,2026-07-16 17:24:41.809642,0 days 00:10:02.024402,COMPLETE,32,6,fused2-agedb-imdb-utkface-wiki48,0.10053596150293279,0.0005241959377180425,9.670068701674336e-05,0.12944565333554625,11,efficientnet,adamw
