number,value,datetime_start,datetime_complete,duration,state,params_batch_size,params_data_augmentation_param,params_dataset,params_dropout_rate,params_learning_rate,params_lr-threshold,params_lr_factor,params_lr_patience,params_model,params_optimizer
0,14.510051450867584,2026-07-16 17:30:33.129465,2026-07-16 17:31:46.724800,0 days 00:01:13.595335,PRUNED,16,16,agedb48,0.3980356693265418,0.0015291770729107341,0.0006179725303302762,0.25278838159166583,9,vgg19,adamw
1,9.324329600884365,2026-07-16 17:31:46.763286,2026-07-16 18:02:05.790508,0 days 00:30:19.027222,COMPLETE,32,10,agedb48,0.20375311258194123,4.891595883152662e-05,0.0001852245980790997,0.2968556170438844,5,vgg19,adam
2,9.388929906098738,2026-07-16 18:02:05.816371,2026-07-16 18:26:51.290365,0 days 00:24:45.473994,COMPLETE,48,2,agedb48,0.3137292303642414,0.0001385516215925371,0.0009014869576847204,0.3940238717501314,12,vgg19,adam
3,9.704222161988705,2026-07-16 18:26:51.312057,2026-07-16 19:50:26.830138,0 days 01:23:35.518081,COMPLETE,8,6,agedb48,0.4424418760864838,1.5760512004034064e-05,3.703704433480259e-05,0.1989641337822465,15,vgg19,adam
4,14.36543530153941,2026-07-16 19:50:26.858528,2026-07-16 19:56:16.781419,0 days 00:05:49.922891,COMPLETE,40,2,agedb48,0.18012495089076896,0.003646648903023743,0.00012301155999909174,0.4236404130537339,8,vgg19,adam
5,8.280894148176994,2026-07-16 19:56:16.809534,2026-07-16 20:22:26.857057,0 days 00:26:10.047523,COMPLETE,8,10,agedb48,0.38937024095683503,0.0012328634146237885,4.32673892906216e-05,0.30443693746137035,16,resnet18,adam
6,44.635983393742485,2026-07-16 20:22:26.971742,2026-07-16 20:23:33.525362,0 days 00:01:06.553620,PRUNED,64,12,agedb48,0.3045771542816833,0.0001543420877723408,0.0006280796738443077,0.20504070432919697,19,efficientnet,sgd
7,11.288760392562203,2026-07-16 20:23:33.560089,2026-07-16 20:27:39.108151,0 days 00:04:05.548062,PRUNED,24,18,agedb48,0.4496476008099699,1.1490320053199555e-05,3.5279080096551474e-05,0.4808729680165045,5,vgg16,adamw
8,13.977866530418396,2026-07-16 20:27:39.142523,2026-07-16 20:29:44.908601,0 days 00:02:05.766078,PRUNED,32,5,agedb48,0.4614170147403184,0.0016150662676599442,0.00010251290196134643,0.17090793532349569,5,vgg19,sgd
9,12.676623199297035,2026-07-16 20:29:44.944934,2026-07-16 20:33:16.897671,0 days 00:03:31.952737,PRUNED,16,20,agedb48,0.26900995073976386,0.00014753917394671922,2.9302438375204984e-05,0.4024826373453434,6,efficientnet,adamw
10,12.258484985517418,2026-07-16 20:33:16.934627,2026-07-16 20:36:14.238757,0 days 00:02:57.304130,PRUNED,8,13,agedb48,0.36214992836756715,0.009421734538671435,0.00024134587111757094,0.10859275674720942,20,resnet18,adam
11,11.209753861173915,2026-07-16 20:36:14.273098,2026-07-16 20:38:15.385237,0 days 00:02:01.112139,PRUNED,16,9,agedb48,0.1292873771965572,0.00045898804881806105,1.7486567919527762e-05,0.3316326092723635,16,mobilenet,adam
12,8.465869531539328,2026-07-16 20:38:15.422497,2026-07-16 21:04:36.649243,0 days 00:26:21.226746,COMPLETE,8,10,agedb48,0.21978218285195425,4.3683262623403434e-05,9.180625321295705e-05,0.31261252277718105,12,resnet18,adam
13,8.073667021765225,2026-07-16 21:04:36.672262,2026-07-16 21:30:58.927902,0 days 00:26:22.255640,COMPLETE,8,7,agedb48,0.23014683258458696,0.0004938286132952503,6.673574799805597e-05,0.30956622826803637,13,resnet18,adam
14,8.260713699359249,2026-07-16 21:30:58.954371,2026-07-16 21:57:21.118871,0 days 00:26:22.164500,COMPLETE,8,6,agedb48,0.1238743361881679,0.0006871887278073128,1.0609018923734053e-05,0.35894741056435686,16,resnet18,adam
15,9.297471351669607,2026-07-16 21:57:21.142216,2026-07-16 22:08:53.678008,0 days 00:11:32.535792,PRUNED,8,5,agedb48,0.1047059008860451,0.0005148475351112787,1.1649374200228493e-05,0.3712479014843775,13,resnet18,sgd
16,9.59368534019028,2026-07-16 22:08:53.714191,2026-07-16 22:19:42.506257,0 days 00:10:48.792066,PRUNED,8,0,agedb48,0.15960366748411653,0.0005797006450684102,1.0358299046889926e-05,0.4640573692629526,18,resnet18,adam
17,8.362729897245693,2026-07-16 22:19:42.542336,2026-07-16 22:57:24.331028,0 days 00:37:41.788692,COMPLETE,16,7,agedb48,0.24208133004057147,0.0003110986355150971,5.5886206108500736e-05,0.35360435394292977,14,vgg16,adam
18,11.390022961989693,2026-07-16 22:57:24.361677,2026-07-16 22:59:26.445682,0 days 00:02:02.084005,PRUNED,16,14,agedb48,0.15040305376649782,0.0070522598110704954,2.1049687538605965e-05,0.26137128643934404,10,mobilenet,adamw
19,10.782836399216583,2026-07-16 22:59:26.482546,2026-07-16 23:10:59.255727,0 days 00:11:32.773181,PRUNED,8,3,agedb48,0.26841519661358504,0.0030110583841392786,6.772959991899485e-05,0.2578736995872017,17,resnet18,sgd
20,8.163143599666835,2026-07-16 23:10:59.292569,2026-07-16 23:37:20.310460,0 days 00:26:21.017891,COMPLETE,8,8,agedb48,0.10400064191239303,0.0009840548710006965,0.00026116800179206654,0.4269226476507234,11,resnet18,adam
21,8.112117498969111,2026-07-16 23:37:20.334924,2026-07-17 00:03:42.396424,0 days 00:26:22.061500,COMPLETE,8,7,agedb48,0.10128117992538162,0.0008995145807798618,0.0002838703171988802,0.43956531120985004,10,resnet18,adam
22,7.893289777967665,2026-07-17 00:03:42.420841,2026-07-17 00:30:05.420212,0 days 00:26:22.999371,COMPLETE,8,8,agedb48,0.18217173316335333,0.0002622597901933786,0.0002926820173616712,0.44863622487944677,10,resnet18,adam
23,8.408596433879097,2026-07-17 00:30:05.451047,2026-07-17 00:54:05.785088,0 days 00:24:00.334041,PRUNED,8,4,agedb48,0.17986880072733508,0.0002896670769169649,0.00040424261416363414,0.4949852034940469,8,resnet18,adam
24,8.191044138825458,2026-07-17 00:54:05.808231,2026-07-17 01:20:40.079495,0 days 00:26:34.271264,COMPLETE,8,12,agedb48,0.20965072180279964,8.230012058830235e-05,0.00015445899320850955,0.44758775208324375,10,resnet18,adam
25,11.882167909456337,2026-07-17 01:20:40.104549,2026-07-17 01:23:05.029298,0 days 00:02:24.924749,PRUNED,24,7,agedb48,0.15583923288725954,0.0002878626690786294,0.0003246682298804529,0.4479936800076665,13,efficientnet,adam
26,11.273885489661913,2026-07-17 01:23:05.066942,2026-07-17 01:25:07.347802,0 days 00:02:02.280860,PRUNED,16,8,agedb48,0.24044453582657824,0.0023326930756704684,0.00043070055812905014,0.39194249865400416,7,mobilenet,adam
27,9.390653648238251,2026-07-17 01:25:07.386195,2026-07-17 01:33:21.468411,0 days 00:08:14.082216,PRUNED,8,0,agedb48,0.18499149503655077,0.00084882049249644,0.00019577421460622863,0.42596355987128776,11,resnet18,adam
28,15.099946132604627,2026-07-17 01:33:21.507987,2026-07-17 01:35:38.032008,0 days 00:02:16.524021,PRUNED,24,11,agedb48,0.29788357094505247,0.00020867681111149766,6.787709237077265e-05,0.475654193331866,9,vgg16,sgd
29,10.706404466559922,2026-07-17 01:35:38.075979,2026-07-17 01:38:39.690625,0 days 00:03:01.614646,PRUNED,8,15,agedb48,0.49425393308388244,0.0016517411195166726,0.0006133733269263715,0.22326486592453149,9,resnet18,adamw
30,8.383328375609025,2026-07-17 01:38:39.728315,2026-07-17 02:05:36.733782,0 days 00:26:57.005467,COMPLETE,8,8,agedb48,0.13503574639686855,7.253777967128892e-05,0.0009833097784864358,0.127755077761528,14,resnet18,adamw
31,11.005617130205827,2026-07-17 02:05:36.759810,2026-07-17 02:08:34.274037,0 days 00:02:57.514227,PRUNED,8,8,agedb48,0.10007892256814388,0.0009413031244505055,0.000279040379141689,0.42595565842798977,11,resnet18,adam
32,8.135828175406525,2026-07-17 02:08:34.312062,2026-07-17 02:34:57.427145,0 days 00:26:23.115083,COMPLETE,8,9,agedb48,0.11760733414703904,0.00040162822384819254,0.00015407499005522213,0.4524549312659158,11,resnet18,adam
33,8.078349416958536,2026-07-17 02:34:57.453149,2026-07-17 03:01:24.101035,0 days 00:26:26.647886,COMPLETE,8,9,agedb48,0.17186339259581754,0.0003079605186457654,0.00015478939179423498,0.49793110837607824,10,resnet18,adam
34,8.496970731279124,2026-07-17 03:01:24.127251,2026-07-17 03:25:30.477126,0 days 00:24:06.349875,PRUNED,8,6,agedb48,0.22809179249786585,9.263068755112922e-05,0.0001965805477717364,0.4996536883925145,8,resnet18,adam
35,9.256776165271152,2026-07-17 03:25:30.502021,2026-07-17 03:33:48.037184,0 days 00:08:17.535163,PRUNED,8,4,agedb48,0.18695688270252775,3.045533379906017e-05,0.00039213731676024984,0.2799592343428903,10,resnet18,adam
36,10.867836300301667,2026-07-17 03:33:48.078132,2026-07-17 03:39:31.804313,0 days 00:05:43.726181,PRUNED,16,11,agedb48,0.2633018795213431,0.00019300201596979952,0.00012427218404300575,0.41010618040511515,12,vgg19,adam
37,11.81071056144825,2026-07-17 03:39:31.845623,2026-07-17 03:41:57.233003,0 days 00:02:25.387380,PRUNED,24,10,agedb48,0.19867581633659415,0.00023247858307252168,0.0006276611563609815,0.3363774511796915,9,efficientnet,adam
38,10.66395446298203,2026-07-17 03:41:57.275001,2026-07-17 03:47:12.905603,0 days 00:05:15.630602,PRUNED,16,7,agedb48,0.16654150330407544,0.00011309174728822436,9.93384984225045e-05,0.37388798331025763,7,vgg16,adam
39,11.330822787998954,2026-07-17 03:47:12.944585,2026-07-17 03:49:15.550402,0 days 00:02:02.605817,PRUNED,16,2,agedb48,0.15032672417433562,0.0003828785774892335,0.0001457683612456298,0.4765030998500392,13,mobilenet,adam
40,13.92586148303488,2026-07-17 03:49:15.590189,2026-07-17 03:51:08.285054,0 days 00:01:52.694865,PRUNED,48,5,agedb48,0.36038754067211415,0.0012946583047768671,0.0004921981879335516,0.3885902408551565,14,vgg19,sgd
41,8.138008991301348,2026-07-17 03:51:08.324427,2026-07-17 04:17:37.602438,0 days 00:26:29.278011,COMPLETE,8,9,agedb48,0.12711140298490595,0.0004143185790922878,0.00021271122176090335,0.45344521954339695,11,resnet18,adam
42,10.018226256117153,2026-07-17 04:17:37.630272,2026-07-17 04:23:14.649720,0 days 00:05:37.019448,PRUNED,8,9,agedb48,0.13758358123004533,0.0006721178600618593,0.000151594014230364,0.44883306543796003,12,resnet18,adam
43,7.879663051614439,2026-07-17 04:23:14.689380,2026-07-17 04:49:45.175664,0 days 00:26:30.486284,COMPLETE,8,11,agedb48,0.20472895000165098,0.0001662191846725306,0.0003140937367643379,0.48442346066141767,10,resnet18,adam
44,8.298211998409695,2026-07-17 04:49:45.206415,2026-07-17 05:12:32.321036,0 days 00:22:47.114621,COMPLETE,8,12,agedb48,0.20772537023737098,0.00015984861910119973,0.00032327010062038725,0.4865116577829589,10,resnet18,adam
45,8.153071531351062,2026-07-17 05:12:32.355183,2026-07-17 05:39:03.662345,0 days 00:26:31.307162,COMPLETE,8,11,agedb48,0.257730275707434,0.00012658337143072457,0.00031910777610424506,0.471846507000706,7,resnet18,adam
46,10.80638641550921,2026-07-17 05:39:03.690491,2026-07-17 05:42:05.389273,0 days 00:03:01.698782,PRUNED,8,17,agedb48,0.23193360486638281,4.730065074708619e-05,8.264678954096668e-05,0.40950038172824227,8,resnet18,adamw
47,12.054998489526602,2026-07-17 05:42:05.430011,2026-07-17 05:43:14.021550,0 days 00:01:08.591539,PRUNED,64,14,agedb48,0.2845954294374802,0.000223186993119022,0.0005377258987305024,0.43652234150182223,10,efficientnet,adam
48,8.361019949406241,2026-07-17 05:43:14.062541,2026-07-17 06:06:00.336651,0 days 00:22:46.274110,COMPLETE,8,10,agedb48,0.1682592993192149,6.368662341934227e-05,0.0007594454793839214,0.16690591995100984,6,resnet18,adam
49,12.421391765852482,2026-07-17 06:06:00.371782,2026-07-17 06:11:43.434637,0 days 00:05:43.062855,PRUNED,16,6,agedb48,0.32108334127736804,0.000545552099077367,0.00023271119149191196,0.499358461236766,15,vgg19,adam
50,11.268952016093305,2026-07-17 06:11:43.475863,2026-07-17 06:14:16.712310,0 days 00:02:33.236447,PRUNED,8,7,agedb48,0.19967838738078172,0.00031657516343461196,5.106194403555831e-05,0.46496136792772164,12,resnet18,sgd
51,8.131008680891876,2026-07-17 06:14:16.754151,2026-07-17 06:40:46.208613,0 days 00:26:29.454462,COMPLETE,8,9,agedb48,0.11611500060833535,0.0004056119964785987,0.00012314684933439364,0.46358702317521944,9,resnet18,adam
52,10.71452231913949,2026-07-17 06:40:46.238280,2026-07-17 06:46:22.979842,0 days 00:05:36.741562,PRUNED,8,10,agedb48,0.14600977319146116,0.0007711890167920432,0.00010586990425848641,0.47963483515502664,9,resnet18,adam
53,8.026583313366066,2026-07-17 06:46:23.021742,2026-07-17 07:12:53.161606,0 days 00:26:30.139864,COMPLETE,8,6,agedb48,0.16970502248796718,0.0001771759238026001,7.477221393425641e-05,0.46564161688165173,9,resnet18,adam
54,8.171882839018595,2026-07-17 07:12:53.190829,2026-07-17 07:39:24.035447,0 days 00:26:30.844618,COMPLETE,8,6,agedb48,0.17479602886046874,0.00017116393413948208,2.8416423245772062e-05,0.4378998133446917,8,resnet18,adam
55,10.431099981501482,2026-07-17 07:39:24.064666,2026-07-17 07:44:39.792898,0 days 00:05:15.728232,PRUNED,16,5,agedb48,0.21960167523912238,0.0001011898421104161,7.711781493619744e-05,0.4107930196867782,10,vgg16,adam
56,9.471543342019048,2026-07-17 07:44:39.834790,2026-07-17 07:50:16.660083,0 days 00:05:36.825293,PRUNED,8,4,agedb48,0.2476473860538364,2.9518031215935596e-05,4.063423684283612e-05,0.2890858707342863,11,resnet18,adam
57,11.451125997276122,2026-07-17 07:50:16.701639,2026-07-17 07:54:12.117330,0 days 00:03:55.415691,PRUNED,8,7,agedb48,0.21044699961436347,0.0002773147803557766,4.993979090884508e-05,0.320122716812856,13,mobilenet,adamw
58,10.615984302212075,2026-07-17 07:54:12.162113,2026-07-17 07:57:10.550621,0 days 00:02:58.388508,PRUNED,8,8,agedb48,0.1929592051210841,0.0018968651514445843,0.00017331347288146277,0.4867881384132731,6,resnet18,adam
59,9.044299947466827,2026-07-17 07:57:10.592587,2026-07-17 08:05:26.865778,0 days 00:08:16.273191,PRUNED,8,3,agedb48,0.168132438547273,0.0011376435741370541,0.0002859521016491533,0.4592121474544977,9,resnet18,adam
60,20.42583043563769,2026-07-17 08:05:26.908506,2026-07-17 08:08:50.181798,0 days 00:03:23.273292,PRUNED,16,12,agedb48,0.28216029700999307,0.00013089021808528826,3.226657590275359e-05,0.43857126714234296,8,efficientnet,sgd
61,8.015494655871738,2026-07-17 08:08:50.225687,2026-07-17 08:35:19.595129,0 days 00:26:29.369442,COMPLETE,8,9,agedb48,0.1210683219235541,0.000538402867991544,0.00011526535139214946,0.4703306696142516,9,resnet18,adam
62,8.014267563819885,2026-07-17 08:35:19.625149,2026-07-17 09:02:16.687744,0 days 00:26:57.062595,COMPLETE,8,8,agedb48,0.14216064197713624,0.0005618172414231552,6.428382152721314e-05,0.4887301902267731,10,resnet18,adam
63,11.436552855127676,2026-07-17 09:02:16.718938,2026-07-17 09:05:22.918713,0 days 00:03:06.199775,PRUNED,8,8,agedb48,0.15706716718205183,0.0006147118297561492,6.587385953954263e-05,0.4880893605597128,10,resnet18,adam
64,9.528086790716015,2026-07-17 09:05:22.961550,2026-07-17 09:11:11.278536,0 days 00:05:48.316986,PRUNED,8,10,agedb48,0.18080125227446917,0.0005101422552519676,5.951007931795583e-05,0.23686919000503476,7,resnet18,adam
65,9.527401964445621,2026-07-17 09:11:11.321702,2026-07-17 09:17:04.648137,0 days 00:05:53.326435,PRUNED,8,20,agedb48,0.13742231186563303,0.00032589395035282124,8.260021384584456e-05,0.47060777614846866,11,resnet18,adam
66,8.155225665672965,2026-07-17 09:17:04.692143,2026-07-17 09:44:46.571560,0 days 00:27:41.879417,COMPLETE,8,6,agedb48,0.14776163421124316,0.00023763601891566098,0.00010699758020515263,0.48551208015048697,12,resnet18,adam
67,9.452871841508985,2026-07-17 09:44:46.603040,2026-07-17 09:50:41.216100,0 days 00:05:54.613060,PRUNED,8,13,agedb48,0.11671481550467755,0.00018518440421938902,4.385299772136552e-05,0.4999631190909832,9,resnet18,adam
68,11.109623223687139,2026-07-17 09:50:41.261002,2026-07-17 09:53:49.740482,0 days 00:03:08.479480,PRUNED,8,11,agedb48,0.22557466432497736,0.0005109853401206096,7.42298610414269e-05,0.1827569441864354,9,resnet18,adam
69,10.45159041132904,2026-07-17 09:53:49.783749,2026-07-17 09:59:42.498592,0 days 00:05:52.714843,PRUNED,16,9,agedb48,0.17699145840502445,0.00036777627849848886,9.009333427618949e-05,0.419452947745592,17,vgg16,adamw
70,11.459589112783975,2026-07-17 09:59:42.542221,2026-07-17 10:03:47.477277,0 days 00:04:04.935056,PRUNED,8,8,agedb48,0.19341557611306026,0.0002642473499849077,0.00012956518369862697,0.46138551162981606,20,mobilenet,adam
71,12.178726625327327,2026-07-17 10:03:47.522088,2026-07-17 10:06:54.114893,0 days 00:03:06.592805,PRUNED,8,7,agedb48,0.1160563369547057,0.001055276668248078,0.0003611769499092642,0.43549316642252256,10,resnet18,adam
72,10.006178248331743,2026-07-17 10:06:54.159334,2026-07-17 10:11:20.792881,0 days 00:04:26.633547,PRUNED,8,6,agedb48,0.1010907575840491,0.0007849694696662853,0.00017471213654598924,0.4738089017414042,10,resnet18,adam
73,9.820087099996742,2026-07-17 10:11:20.839261,2026-07-17 10:15:50.131909,0 days 00:04:29.292648,PRUNED,8,9,agedb48,0.12812045379306786,0.0006180699214233424,0.0002131440941719614,0.45134370773691174,11,resnet18,adam
74,9.873521268655713,2026-07-17 10:15:50.176287,2026-07-17 10:20:20.326295,0 days 00:04:30.150008,PRUNED,8,7,agedb48,0.162745475391601,0.0004310435646850832,0.00024261562770456498,0.38124453702113714,8,resnet18,adam
75,15.084036389410784,2026-07-17 10:20:20.373355,2026-07-17 10:26:16.461583,0 days 00:05:56.088228,PRUNED,16,5,agedb48,0.14120949732127835,0.001475829499458304,5.906571419293385e-05,0.3604252547240065,11,vgg19,adam
76,8.073140026866525,2026-07-17 10:26:16.506669,2026-07-17 10:53:30.451682,0 days 00:27:13.945013,COMPLETE,8,8,agedb48,0.20819177828186902,0.0001494994044321228,0.00043246176320933127,0.4901963045503979,10,resnet18,adam
77,8.026388396387516,2026-07-17 10:53:30.484093,2026-07-17 11:20:37.852444,0 days 00:27:07.368351,COMPLETE,8,8,agedb48,0.20788572855671525,0.00017501280899732619,0.00048067459025901164,0.4909750277449253,9,resnet18,adam
78,11.580913472866666,2026-07-17 11:20:37.886779,2026-07-17 11:23:11.035191,0 days 00:02:33.148412,PRUNED,8,8,agedb48,0.21527888546188367,0.00014350376231706514,0.0003949470898258424,0.4828967707583263,9,resnet18,sgd
79,9.135206908419512,2026-07-17 11:23:11.079793,2026-07-17 11:32:49.208969,0 days 00:09:38.129176,PRUNED,8,10,agedb48,0.247204425060774,6.142661176729256e-05,0.00046515117281087354,0.4896689756876913,8,resnet18,adam
80,12.575535566910453,2026-07-17 11:32:49.254110,2026-07-17 11:36:23.039164,0 days 00:03:33.785054,PRUNED,16,11,agedb48,0.1865940117651999,8.66006281650759e-05,0.0006847688210264805,0.46949530725299576,15,efficientnet,adam
81,8.052175161919155,2026-07-17 11:36:23.085118,2026-07-17 12:03:05.575330,0 days 00:26:42.490212,COMPLETE,8,8,agedb48,0.23465862102014473,0.00019568633825232435,0.000515887107968516,0.4775370274527291,10,resnet18,adam
82,8.032893181423058,2026-07-17 12:03:05.609631,2026-07-17 12:30:00.017946,0 days 00:26:54.408315,COMPLETE,8,8,agedb48,0.23179652067207457,0.00019733644959661487,0.0008274279881678235,0.45583385506294677,10,resnet18,adam
83,8.161834011907162,2026-07-17 12:30:00.050869,2026-07-17 12:56:35.413856,0 days 00:26:35.362987,COMPLETE,8,8,agedb48,0.23113728242365988,0.00011982259324718936,0.0007107738437966645,0.4569437992042911,10,resnet18,adam
84,8.04662953828268,2026-07-17 12:56:35.447214,2026-07-17 13:23:08.990053,0 days 00:26:33.542839,COMPLETE,8,9,agedb48,0.2559543089717784,0.00016034749501971977,0.0008613638025247247,0.4432661678275879,10,resnet18,adam
85,8.046469369948198,2026-07-17 13:23:09.026630,2026-07-17 13:49:44.033069,0 days 00:26:35.006439,COMPLETE,8,9,agedb48,0.25121592757821204,0.00019901309772137076,0.000923761514359602,0.44372359338347134,9,resnet18,adam
86,8.198539885345864,2026-07-17 13:49:44.070225,2026-07-17 14:16:20.254483,0 days 00:26:36.184258,COMPLETE,8,10,agedb48,0.256486436814909,0.0001008242647353747,0.0008745346699883284,0.41962117066232485,9,resnet18,adam
87,7.991430571689698,2026-07-17 14:16:20.287663,2026-07-17 14:42:53.939259,0 days 00:26:33.651596,COMPLETE,8,9,agedb48,0.2774160476980084,0.00022351441501349768,0.0009073772646588943,0.4012776531391188,9,resnet18,adam
88,9.778008398226493,2026-07-17 14:42:53.972997,2026-07-17 14:47:12.537374,0 days 00:04:18.564377,PRUNED,8,12,agedb48,0.3216369228631923,0.0002629625177015171,0.000801251000560799,0.4001765179426008,7,resnet18,adam
89,10.609404084763089,2026-07-17 14:47:12.582838,2026-07-17 14:52:48.512047,0 days 00:05:35.929209,PRUNED,16,7,agedb48,0.27341872898999764,0.00022637035658240373,0.0005689332571436947,0.428964880639653,8,vgg16,adamw
90,10.9282072039618,2026-07-17 14:52:48.559043,2026-07-17 14:58:32.402166,0 days 00:05:43.843123,PRUNED,16,10,agedb48,0.3054223956850092,0.00019880790688080576,0.0009184534278837484,0.45640741255357103,9,vgg19,adam
91,8.084508444951927,2026-07-17 14:58:32.448327,2026-07-17 15:25:11.308201,0 days 00:26:38.859874,COMPLETE,8,9,agedb48,0.27098203050078157,0.00016500680901218812,0.0008031054988652489,0.44568027216625766,9,resnet18,adam
92,8.477504276423062,2026-07-17 15:25:11.342859,2026-07-17 15:43:09.806399,0 days 00:17:58.463540,PRUNED,8,9,agedb48,0.290592666682288,0.0001095925015804156,0.0009669616549206338,0.4431653705511444,11,resnet18,adam
93,10.02886280518223,2026-07-17 15:43:09.853999,2026-07-17 15:47:37.189730,0 days 00:04:27.335731,PRUNED,8,11,agedb48,0.2567305350034555,0.0003299514394774996,0.0005884048656721779,0.465394242913332,9,resnet18,adam
94,9.165974498946886,2026-07-17 15:47:37.238353,2026-07-17 15:57:33.058350,0 days 00:09:55.819997,PRUNED,8,13,agedb48,0.2423284238797654,0.00013385381540012228,0.0007230935666451364,0.42866599147941803,8,resnet18,adam
