number,value,datetime_start,datetime_complete,duration,state,params_batch_size,params_data_augmentation_param,params_dataset,params_dropout_rate,params_learning_rate,params_lr-threshold,params_lr_factor,params_lr_patience,params_model,params_optimizer
0,12.239907315028972,2026-07-11 11:42:34.427835,2026-07-11 12:17:15.426089,0 days 00:34:40.998254,COMPLETE,8,8,agedb48,0.44096148485874564,1.1139931200530962e-05,0.0007883551886800222,0.4961359618375917,13,mobilenet,adamw
1,8.454455666542053,2026-07-11 12:17:15.457718,2026-07-11 12:48:04.222252,0 days 00:30:48.764534,COMPLETE,32,6,agedb224,0.3129849165407582,0.0011655880702479023,5.5033686862703405e-05,0.4567854809515831,5,mobilenet,sgd
2,7.141033463012007,2026-07-11 12:48:04.252661,2026-07-11 15:46:23.652689,0 days 02:58:19.400028,COMPLETE,24,19,agedb224,0.3740460989721893,3.196165325767653e-05,0.0006989860841216614,0.18107621863169127,14,vgg16,adam
3,7.2194625282287594,2026-07-11 15:46:23.677577,2026-07-11 18:23:14.873318,0 days 02:36:51.195741,COMPLETE,32,4,agedb224,0.35483769083726213,0.0002136609917391515,0.0001899861017950162,0.17678613002061894,13,vgg16,adamw
4,15.058087873458863,2026-07-11 18:23:14.895217,2026-07-11 19:22:30.493443,0 days 00:59:15.598226,COMPLETE,32,13,agedb224,0.1429691462806878,0.0010605582037937862,6.156540214382425e-05,0.2783186686909294,5,vgg19,adam
5,12.204203675739729,2026-07-11 19:22:30.521281,2026-07-11 19:29:42.222198,0 days 00:07:11.700917,PRUNED,8,2,agedb224,0.4956737013886162,0.009016430289705994,4.462552583910534e-05,0.3299190037869205,8,mobilenet,adamw
6,10.594209433800012,2026-07-11 19:29:42.259379,2026-07-11 19:35:55.670488,0 days 00:06:13.411109,PRUNED,16,20,agedb224,0.2603307098410276,0.0001447169536113772,0.00044465063580364036,0.3793238696426402,11,mobilenet,adam
7,11.279309845449937,2026-07-11 19:35:55.708177,2026-07-11 19:42:10.921509,0 days 00:06:15.213332,PRUNED,16,8,agedb224,0.1584449334609237,4.7992547010159e-05,0.0006165835354922312,0.3922704092919225,5,mobilenet,adam
8,45.88463016022417,2026-07-11 19:42:10.962046,2026-07-11 19:43:48.996854,0 days 00:01:38.034808,PRUNED,24,4,agedb48,0.3920661236794989,1.1772962359591815e-05,0.0001958618323511225,0.34319703434724325,19,mobilenet,sgd
9,5.159855792396947,2026-07-11 19:43:49.031481,2026-07-11 19:58:35.869701,0 days 00:14:46.838220,COMPLETE,24,3,agedb48,0.24186706624231447,0.00016309119657100665,2.6234772348890396e-05,0.4349727302179578,8,resnet18,adamw
10,12.119616589953552,2026-07-11 19:58:35.894767,2026-07-11 20:00:51.768356,0 days 00:02:15.873589,PRUNED,16,14,agedb48,0.24875424595178133,0.007524160564458078,1.405930657892179e-05,0.10295413983792706,20,resnet18,adamw
11,10.569054094472326,2026-07-11 20:00:51.803652,2026-07-11 20:04:08.598559,0 days 00:03:16.794907,PRUNED,24,19,agedb48,0.22236469298797115,5.411083603040076e-05,1.1175981729582775e-05,0.23549248149158544,16,resnet18,adam
12,12.157607965302049,2026-07-11 20:04:08.634488,2026-07-11 20:05:41.553713,0 days 00:01:32.919225,PRUNED,56,0,agedb48,0.30971360998742015,4.808648191232148e-05,2.412571010417654e-05,0.10324836554040037,10,efficientnet,adamw
13,10.814562463760376,2026-07-11 20:05:41.591074,2026-07-11 20:08:55.506552,0 days 00:03:13.915478,PRUNED,40,13,agedb48,0.19210593158311895,0.0002935728892279945,0.00018126387447496515,0.20090151036938864,17,vgg16,adam
14,14.569075046625352,2026-07-11 20:08:55.543288,2026-07-11 20:26:22.543206,0 days 00:17:26.999918,PRUNED,24,16,agedb224,0.412305949387247,0.0006038457145519171,0.00011215780503551746,0.2836827908652663,8,resnet18,sgd
15,10.697548937441697,2026-07-11 20:26:22.591798,2026-07-11 20:29:20.941523,0 days 00:02:58.349725,PRUNED,48,10,agedb48,0.10874714775573996,2.6614691906887436e-05,0.0003721633544316529,0.41262166564364033,15,vgg16,adamw
16,11.295211257791161,2026-07-11 20:29:20.978087,2026-07-11 20:34:02.694891,0 days 00:04:41.716804,PRUNED,24,17,agedb48,0.3069858595447364,0.00010396209044186471,2.460217860885143e-05,0.1620040700071164,8,vgg19,adam
17,7.045181941986084,2026-07-11 20:34:02.731950,2026-07-11 21:47:58.907246,0 days 01:13:56.175296,COMPLETE,40,10,agedb224,0.49280405009410866,0.000419033617504901,0.00011480940400230343,0.25551213819178054,13,efficientnet,adam
18,8.895525177912926,2026-07-11 21:47:58.938264,2026-07-11 22:18:46.488970,0 days 00:30:47.550706,PRUNED,48,10,agedb224,0.49681545844146174,0.0028977902931830233,9.180287403279525e-05,0.44150570246632126,11,efficientnet,adamw
19,11.118033534288406,2026-07-11 22:18:46.531076,2026-07-11 22:20:34.171620,0 days 00:01:47.640544,PRUNED,40,0,agedb48,0.45669485437803337,0.0005308090686956906,2.650101790581929e-05,0.30642509380651356,10,efficientnet,sgd
20,12.27354805313762,2026-07-11 22:20:34.213177,2026-07-11 22:46:40.296559,0 days 00:26:06.083382,PRUNED,8,10,agedb224,0.34619075904778845,0.002529349410172281,3.9329401521702804e-05,0.24209246659303593,18,resnet18,adamw
21,10.262297421693802,2026-07-11 22:46:40.337551,2026-07-11 23:06:08.078020,0 days 00:19:27.740469,PRUNED,40,17,agedb224,0.37286265256016876,8.231537630731665e-05,0.0009987205260824238,0.22159600552017303,14,vgg16,adam
22,7.878707075119019,2026-07-11 23:06:08.118456,2026-07-11 23:36:33.413936,0 days 00:30:25.295480,PRUNED,64,5,agedb224,0.442678929425173,0.00034297298959942723,0.000370770858945491,0.16056814477810447,13,efficientnet,adam
23,10.375082368850707,2026-07-11 23:36:33.456249,2026-07-11 23:54:43.635403,0 days 00:18:10.179154,PRUNED,32,8,agedb224,0.2809283865952783,2.577719654940818e-05,0.00011628116475751563,0.13079289391450127,15,vgg16,adam
24,8.318855634376185,2026-07-11 23:54:43.676208,2026-07-12 00:21:54.708263,0 days 00:27:11.032055,PRUNED,48,15,agedb224,0.40820369934536826,0.00016206265169043386,0.00027824090782315976,0.2630144000486533,7,efficientnet,adam
25,10.403464470676441,2026-07-12 00:21:54.750559,2026-07-12 00:40:31.809526,0 days 00:18:37.058967,PRUNED,16,12,agedb224,0.209660171834497,2.462264084193867e-05,7.845602349677281e-05,0.1985307676284001,12,resnet18,adam
26,11.193310095851583,2026-07-12 00:40:31.853926,2026-07-12 00:45:14.258330,0 days 00:04:42.404404,PRUNED,24,2,agedb48,0.47121934556811446,0.0004740578457956526,1.8411738446697457e-05,0.4968796299843696,17,vgg19,adam
27,10.533017213620132,2026-07-12 00:45:14.297630,2026-07-12 01:03:51.255832,0 days 00:18:36.958202,PRUNED,16,18,agedb224,0.3504071690690684,0.0010882629479378987,3.3213939254960363e-05,0.3464622761221794,10,resnet18,adam
28,46.96499984741211,2026-07-12 01:03:51.304326,2026-07-12 01:06:08.358204,0 days 00:02:17.053878,PRUNED,32,6,agedb48,0.4064126431911341,7.643805822070314e-05,0.00015627979757339372,0.13598707098621002,15,vgg16,sgd
29,28.233744303385418,2026-07-12 01:06:08.397744,2026-07-12 01:07:42.581822,0 days 00:01:34.184078,PRUNED,56,8,agedb48,0.43113230361977617,1.1943010283804948e-05,0.0006135383806212349,0.468152621528853,13,efficientnet,adamw
30,7.302549916505813,2026-07-12 01:07:42.621731,2026-07-12 02:10:03.115272,0 days 01:02:20.493541,COMPLETE,40,11,agedb224,0.37962291770431855,0.0002461053606281012,0.00028215917461005675,0.31458149494230625,7,efficientnet,adamw
31,7.227851028442383,2026-07-12 02:10:03.147068,2026-07-12 04:32:36.962736,0 days 02:22:33.815668,COMPLETE,32,3,agedb224,0.3340903939400308,0.0001860599061663173,0.0006624241238189775,0.17266481734300868,12,vgg16,adamw
32,10.59613495349884,2026-07-12 04:32:36.991992,2026-07-12 04:50:50.275046,0 days 00:18:13.283054,PRUNED,32,6,agedb224,0.2855774449920655,0.0007459892154505306,0.00025119340344416553,0.19582255641000154,12,vgg16,adamw
33,9.260184417093607,2026-07-12 04:50:50.318914,2026-07-12 05:11:30.967753,0 days 00:20:40.648839,PRUNED,24,2,agedb224,0.4731664502245397,0.0003486107473023054,5.441887452629512e-05,0.1351963252009694,13,vgg16,adamw
34,15.152723751068116,2026-07-12 05:11:31.011637,2026-07-12 05:29:41.798271,0 days 00:18:10.786634,PRUNED,32,4,agedb224,0.35728776455233646,0.0018888573596238527,0.00013573365815808413,0.2597418835943702,14,vgg16,adamw
35,9.666761115081329,2026-07-12 05:29:41.843029,2026-07-12 05:53:24.579628,0 days 00:23:42.736599,PRUNED,24,7,agedb224,0.16743240209275673,0.00021508797486290184,7.359137371259923e-05,0.220011305646204,14,vgg19,adamw
36,9.67117971777916,2026-07-12 05:53:24.622536,2026-07-12 06:12:51.362404,0 days 00:19:26.739868,PRUNED,40,2,agedb224,0.24575912120083698,9.83327360049463e-05,0.0005076993991680143,0.1784848956270444,9,vgg16,adam
37,11.68146717787987,2026-07-12 06:12:51.408994,2026-07-12 06:38:30.453238,0 days 00:25:39.044244,PRUNED,8,4,agedb224,0.32259232403388627,0.00012902086689305854,0.0008947763859274188,0.4651599453538177,16,resnet18,sgd
38,10.277430362271186,2026-07-12 06:38:30.495617,2026-07-12 06:44:24.874170,0 days 00:05:54.378553,PRUNED,24,20,agedb224,0.2871336190816367,0.0008567589246642738,0.00019059881230211784,0.38945742215403856,5,mobilenet,adamw
39,9.643577728271485,2026-07-12 06:44:24.917798,2026-07-12 07:02:34.282629,0 days 00:18:09.364831,PRUNED,32,1,agedb224,0.12033173947623935,3.3801587884888337e-05,5.82855435000922e-05,0.42446457882501676,12,vgg16,adam
40,12.547772866442688,2026-07-12 07:02:34.326832,2026-07-12 07:04:19.576892,0 days 00:01:45.250060,PRUNED,24,9,agedb48,0.43206369784071486,6.840281466770038e-05,1.0796550577850106e-05,0.3691331295685869,11,mobilenet,adamw
41,7.244460501670837,2026-07-12 07:04:19.618479,2026-07-12 09:30:00.085600,0 days 02:25:40.467121,COMPLETE,32,3,agedb224,0.33713179576499375,0.00017989984555563202,0.0007087345357045927,0.16672927361826334,13,vgg16,adamw
42,9.64110818862915,2026-07-12 09:30:00.119504,2026-07-12 09:48:16.091620,0 days 00:18:15.972116,PRUNED,32,5,agedb224,0.2707652201440853,0.0003949915261856459,0.0005012261112148425,0.18774839227985915,12,vgg16,adamw
43,10.81756049990654,2026-07-12 09:48:16.135051,2026-07-12 10:07:55.526145,0 days 00:19:39.391094,PRUNED,40,3,agedb224,0.3275456917460158,1.6598857476282415e-05,0.0007123681107352718,0.15000517279798783,14,vgg16,adamw
44,9.267851580327479,2026-07-12 10:07:55.569154,2026-07-12 10:26:38.265467,0 days 00:18:42.696313,PRUNED,16,1,agedb224,0.36917032396022076,0.0001292094789092284,0.00036129158041339684,0.11259236482752838,16,resnet18,adamw
45,9.79889832019806,2026-07-12 10:26:38.310860,2026-07-12 10:44:46.554895,0 days 00:18:08.244035,PRUNED,32,3,agedb224,0.24314028758233386,0.00024941054293951934,0.00042749578739619746,0.21104195043573715,6,vgg16,adam
46,13.390956807492385,2026-07-12 10:44:46.600226,2026-07-12 10:46:27.833398,0 days 00:01:41.233172,PRUNED,48,5,agedb48,0.3025416156287669,4.2009280428849335e-05,1.773302716293704e-05,0.24035880280412886,11,efficientnet,adamw
47,14.536890001296998,2026-07-12 10:46:27.875647,2026-07-12 11:03:27.496957,0 days 00:16:59.621310,PRUNED,32,14,agedb224,0.3916847089709529,0.0015986008112836457,0.0005820840518059426,0.2849529823043371,15,vgg16,sgd
48,10.55820812139296,2026-07-12 11:03:27.562534,2026-07-12 11:08:10.045502,0 days 00:04:42.482968,PRUNED,24,1,agedb48,0.19406663139062819,0.00018986903667989716,0.00023341619202714127,0.17896712608863785,9,vgg19,adam
49,9.823989690847732,2026-07-12 11:08:10.087680,2026-07-12 11:26:51.446076,0 days 00:18:41.358396,PRUNED,16,7,agedb224,0.2203192890816258,0.0006300683604069011,4.5852557095144796e-05,0.148751895831,20,resnet18,adamw
